{
  "schema_version": "1.0",
  "document_type": "perceptshift.profile_bundle",
  "bundle_id": "b1",
  "product_version": "0.1.0",
  "minimum_compatible_runtime_version": "0.1.0",
  "created_at": "2026-08-06T00:00:00Z",
  "producer": {
    "product": "perceptshift",
    "version": "0.1.0",
    "git_commit": "deadbeef"
  },
  "adapter": {
    "name": "image_classification"
  },
  "quality_metric_name": "top1_accuracy",
  "quality_direction": "higher_is_better",
  "profiles": [
    {
      "profile_id": "p1",
      "label": "baseline",
      "model_sha256": "aaaaaaaaaaaaaaaaaaaaaaaaaaaaaaaaaaaaaaaaaaaaaaaaaaaaaaaaaaaaaaaa",
      "model_relative_path": "models/aaaaaaaaaaaaaaaaaaaaaaaaaaaaaaaaaaaaaaaaaaaaaaaaaaaaaaaaaaaaaaaa.onnx",
      "status": "certified",
      "session": {},
      "adapter": {},
      "preprocess": {}
    }
  ],
  "files": [
    {
      "path": "manifest.json",
      "sha256": "bbbbbbbbbbbbbbbbbbbbbbbbbbbbbbbbbbbbbbbbbbbbbbbbbbbbbbbbbbbbbbbb",
      "size_bytes": 1
    }
  ]
}
